{
  "v": 1,
  "eventId": "evt-example",
  "action": "ALLOW",
  "reasonCode": "rule_hit",
  "ruleIds": [],
  "risk": "none",
  "family": null,
  "policy": {
    "version": 1,
    "rulesHash": "sha256:51003ce0c1fdf505f5c5384dc00be53f2e4c5e4a788a57b1919e48d807ad9a8b"
  },
  "engineRevision": 0,
  "origin": "SERVER",
  "privacy": {
    "findings": [],
    "rewriteStatus": "NONE"
  },
  "explain": [
    {
      "layer": "protected",
      "result": "no_match"
    }
  ],
  "userMessage": "NMZP schema example. No matched secret is included."
}
